identifier	dc Terms	Class	Term	中譯	Definition	定義	Comment	註解	Examples	範例	Link
occurrence:1		 Data Set	Occurrence		An existence of an Organism (sensu http://rs.tdwg.org/dwc/terms/Organism) at a particular place at a particular time.				A wolf pack on the shore of Kluane Lake in 1988. A virus in a plant leaf in a the New York Botanical Garden at 15:29 on 2014-10-23. A fungus in Central Park in the summer of 1929. 		http://terms.tdwg.org/wiki/dwc:Occurrence
occurrence:2		Occurrence	occurrenceID	生物出現紀錄識別碼	An identifier for the Occurrence (as opposed to a particular digital record of the occurrence). In the absence of a persistent global unique identifier, construct one from a combination of identifiers in the record that will most closely make the occurrenceID globally unique.	TDWG 定義生物出現紀錄 (occurrence) 為「特定生物於特定時間存在於特定地點」。而為確保資料集中生物出現紀錄的唯一性，需要至少在資料集內部為獨一無二的識別碼，此即 occurrenceID。	For a specimen in the absence of a bona fide global unique identifier, for example, use the form: "urn:catalog:[institutionCode]:[collectionCode]:[catalogNumber].		"urn:lsid:nhm.ku.edu:Herps:32",  "urn:catalog:FMNH:Mammal:145732".		http://terms.tdwg.org/wiki/dwc:occurrenceID
occurrence:3		Occurrence	catalogNumber	編目號	An identifier (preferably unique) for the record within the data set or collection.	於資料集或館藏品中紀錄的識別碼（具唯一性者佳）。			"2008.1334",  "145732a",  "145732".		http://terms.tdwg.org/wiki/dwc:catalogNumber
occurrence:4		Occurrence	recordNumber	野外採集號	An identifier given to the Occurrence at the time it was recorded. Often serves as a link between field notes and an Occurrence record, such as a specimen collector's number.	在 TDWG 釋出的 DwC 官方文件中，record 帶有「現地紀錄」或「於現地所做紀錄」的意涵。由此衍生，recordNumber 係指紀錄者在紀錄產生當下配賦給紀錄的編碼。			OPP 7101		http://terms.tdwg.org/wiki/dwc:recordNumber
occurrence:5		Occurrence	recordedBy	資料記錄者	A list (concatenated and separated) of names of people, groups, or organizations responsible for recording the original Occurrence. The primary collector or observer, especially one who applies a personal identifier (recordNumber), should be listed first.	記錄出現記錄的人名、團體或組織名單(以標點符號分隔)。本名單之第一順位應是賦予此筆紀錄個人識別碼(紀錄編號(recordNumber)的人名、團體或組織名字。	The recommended best practice is to separate the values with a vertical bar (' | '). The primary collector or observer, especially one who applies a personal identifier (recordNumber), should be listed first.		"José E. Crespo",  "Oliver P. Pearson | Anita K. Pearson" where the value in recordNumber "OPP 7101" corresponds to the number for the specimen in the field catalog (collector number) of Oliver P. Pearson.		http://terms.tdwg.org/wiki/dwc:recordedBy
occurrence:6		Occurrence	individualCount	個體數	The number of individuals represented present at the time of the Occurrence.	Occurrence 中被記錄到的生物個體數			"1",  "25".		http://terms.tdwg.org/wiki/dwc:individualCount
occurrence:7		Occurrence	organismQuantity	數值	A number or enumeration value for the quantity of organisms.		An organismQuantity must have a corresponding organismQuantityType, e.g.,  "27" for organismQuantity with "individuals" for organismQuantityType; "12.5" for organismQuantity with "%biomass" for organismQuantityType; "r" for organismQuantity with "BraunBlanquetScale" for organismQuantityType.				http://terms.tdwg.org/wiki/dwc:organismQuantity
occurrence:8		Occurrence	organismQuantityType	單位	The type of quantification system used for the quantity of organisms.		An organismQuantityType must have a corresponding organismQuantity, e.g.,  "27" for organismQuantity with "individuals" for organismQuantityType; "12.5" for organismQuantity with "%biomass" for organismQuantityType; "r" for organismQuantity with "BraunBlanquetScale" for organismQuantityType.				http://terms.tdwg.org/wiki/dwc:organismQuantityType
occurrence:9		Occurrence	sex	性別	The sex of the biological individual(s) represented in the Occurrence. Recommended best practice is to use a controlled vocabulary.	生物出現紀錄中呈現的生物個體性別，建議使用控制詞彙。如"雄"、“雌雄同體”、“雌”。			"female",  "hermaphrodite",  "8 males, 4 females".		http://terms.tdwg.org/wiki/dwc:sex
occurrence:10		Occurrence	lifeStage	生活史階段	The age class or life stage of the biological individual(s) at the time the Occurrence was recorded. Recommended best practice is to use a controlled vocabulary.	生物個體被記錄時的齡級或生活史階段，建議使用控制詞彙。如:“卵”、“水蜥階段(eft)”、“幼齡(juvenile)”、“成體(adult)”、“2 成體 4 幼齡”			"egg",  "eft",  "juvenile",  "adult",  "2 adults 4 juveniles".		http://terms.tdwg.org/wiki/dwc:lifeStage
occurrence:11		Occurrence	reproductiveCondition	生殖狀況	The reproductive condition of the biological individual(s) represented in the Occurrence. Recommended best practice is to use a controlled vocabulary.	生物個體被記錄時的生殖相關狀態，建議使用控制詞彙。如:“非繁殖狀態”、“懷孕”、“開花”、"結果"等			"non-reproductive",  "pregnant",  "in bloom",  "fruit-bearing".		http://terms.tdwg.org/wiki/dwc:reproductiveCondition
occurrence:12		Occurrence	behavior	行為	A description of the behavior shown by the subject at the time the Occurrence was recorded. Recommended best practice is to use a controlled vocabulary.	生物個體被記錄時的行為，建議使用控制詞彙。如:“築巢”、“覓食”、"奔跑"等			"roosting",  "foraging",  "running".		http://terms.tdwg.org/wiki/dwc:behavior
occurrence:13		Occurrence	establishmentMeans	拓殖意義	The process by which the biological individual(s) represented in the Occurrence became established at the location. Recommended best practice is to use a controlled vocabulary.	生物個體於一個新地區拓殖時，其拓展所代表的意義。如:“原生”、“入侵”、“引進”、“歸化”、"管控中"等			"native",  "introduced",  "naturalised",  "invasive",  "managed".		http://terms.tdwg.org/wiki/dwc:establishmentMeans
occurrence:14		Occurrence	occurrenceStatus	出現狀態	A statement about the presence or absence of a Taxon at a Location. Recommended best practice is to use a controlled vocabulary.				"present",  "absent".		http://terms.tdwg.org/wiki/dwc:occurrenceStatus
occurrence:15		Occurrence	preparations	製備過程	A list (concatenated and separated) of preparations and preservation methods for a specimen.	標本處理及保存方法清單(使用標點符號分隔)。	The recommended best practice is to separate the values with a vertical bar (' | ').		"fossil",  "cast",  "photograph",  "DNA extract",  "skin | "skull | skeleton",  "whole animal (ETOH) | tissue (EDTA)".		http://terms.tdwg.org/wiki/dwc:preparations
occurrence:16		Occurrence	disposition	標本現況	The current state of a specimen with respect to the collection identified in collectionCode or collectionID. Recommended best practice is to use a controlled vocabulary.	被登記於某collectionID或CollectionCode的標本，其目前的狀態，建議使用控制詞彙。如"典藏中"、“遺失”、“外借他處”、“複本於他處”			"in collection",  "missing",  "voucher elsewhere",  "duplicates elsewhere".		http://terms.tdwg.org/wiki/dwc:disposition
occurrence:17		Occurrence	associatedMedia	相關記載媒體	A list (concatenated and separated) of identifiers (publication, global unique identifier, URI) of media associated with the Occurrence.	與此出現紀錄的相關各式媒體(如影像、影片、音訊等資訊於出版刊物、全球唯一識別碼、網址或其他URI等出處)列表(使用標點符號分隔)。	The recommended best practice is to separate the values with a vertical bar (' | ').		"http://arctos.database.museum/SpecimenImages/UAMObs/Mamm/2/P7291179.JPG",  "http://204.140.246.24/Fish/Collection%20Pictures/10118-00.jpg | http://204.140.246.24/Fish/Collection%20Pictures/10118-00a.jpg".		http://terms.tdwg.org/wiki/dwc:associatedMedia
occurrence:18		Occurrence	associatedReferences	相關文獻	A list (concatenated and separated) of identifiers (publication, bibliographic reference, global unique identifier, URI) of literature associated with the Occurrence.	與此出現紀錄相關的文獻(如出版刊物、學術引用、全球唯一識別碼或URI等)列表(使用標點符號分隔)。	The recommended best practice is to separate the values with a vertical bar (' | ').		"http://www.sciencemag.org/cgi/content/abstract/322/5899/261",  "Christopher J. Conroy, Jennifer L. Neuwald. 2008. Phylogeographic study of the California vole, Microtus californicus Journal of Mammalogy, 89(3):755-767.",  "Steven R. Hoofer and Ronald A. Van Den Bussche. 2001. Phylogenetic Relationships of Plecotine Bats and Allies Based on Mitochondrial Ribosomal Sequences. Journal of Mammalogy 82(1):131-137. | Walker, Faith M., Jeffrey T. Foster, Kevin P. Drees, Carol L. Chambers. 2014. Spotted bat (Euderma maculatum) microsatellite discovery using illumina sequencing. Conservation Genetics Resources.".		http://terms.tdwg.org/wiki/dwc:associatedReferences
occurrence:19		Occurrence	associatedSequences	相關遺傳序列	A list (concatenated and separated) of identifiers (publication, global unique identifier, URI) of genetic sequence information associated with the Occurrence.	與此出現紀錄相關的遺傳序列(如出版刊物、全球唯一識別碼或URI等)列表(使用標點符號分隔)。	The recommended best practice is to separate the values with a vertical bar (' | ').		"http://www.ncbi.nlm.nih.gov/nuccore/U34853.1",  "http://www.ncbi.nlm.nih.gov/nuccore/GU328060 | http://www.ncbi.nlm.nih.gov/nuccore/AF326093".		http://terms.tdwg.org/wiki/dwc:associatedSequences
occurrence:20		Occurrence	associatedTaxa	相關類群	A list (concatenated and separated) of identifiers or names of taxa and their associations with the Occurrence.	與此出現紀錄相關的生物名錄(使用標點符號分隔)，如 “host: Quercus alba”、“parasitoid of:Cyclocephala signaticollis | predator of Apis mellifera”。	The recommended best practice is to separate the values with a vertical bar (' | '), and to separate the relationship from the taxon with a colon (':').		"host: Quercus alba",  "parasitoid of:Cyclocephala signaticollis | predator of Apis mellifera".		http://terms.tdwg.org/wiki/dwc:associatedTaxa
occurrence:21		Occurrence	otherCatalogNumbers	其他紀錄代號	A list (concatenated and separated) of previous or alternate fully qualified catalog numbers or other human-used identifiers for the same Occurrence, whether in the current or any other data set or collection.	此筆紀錄先前被任何人所發表的完整、被認可的代號或編號列表(使用標點符號分隔)，無論是否在相同的資料集或其他藏品中。如"FMNH:Mammal:1234"、“NPS YELLO6778 | MBG 33424”。	The recommended best practice is to separate the values with a vertical bar (' | ').		"FMNH:Mammal:1234",  "NPS YELLO6778 | MBG 33424".		http://terms.tdwg.org/wiki/dwc:otherCatalogNumbers
occurrence:22		Occurrence	occurrenceRemarks	出現記錄概述	Comments or notes about the Occurrence.	針對此筆出現記錄的描述或筆記。如 “found dead on road”			 "found dead on road".		http://terms.tdwg.org/wiki/dwc:occurrenceRemarks